{
  "artifacts": {
    "canonical": {
      "bytes": 87118325,
      "digest": "sha256:d9b0150b78ca1f9926e0eb14903c7baa0a9679c0c7b0469fe45f78e1975fe84b",
      "path": "generated/phase6/candidate/enemy-data-v2.canonical.json",
      "schemaVersion": "2.0.0"
    },
    "omissionReport": {
      "bytes": 2394,
      "digest": "sha256:723843dabb2c657ac5dc886ade573676fe6fbb4550433763bba7461669dc4e22",
      "path": "artifacts/phase6/runtime-omission-report.json",
      "schemaVersion": "1.0.0"
    },
    "runtime": {
      "bytes": 16691030,
      "digest": "sha256:985a7debb714a19ea285c3d208cfb18900ef91aed2f1638ae38bacf68d1b05bb",
      "path": "generated/phase6/candidate/enemy-data-runtime-v1.json",
      "schemaVersion": "1.0.0"
    },
    "sourceInput": {
      "bytes": 35532102,
      "digest": "sha256:4f42c83fba42180c6960418a01980c4bd33d10102c30761322ade7289388e307",
      "path": "generated/phase4/candidate/enemy-data-v1.candidate.json",
      "schemaVersion": "1"
    },
    "validationReport": {
      "bytes": 909,
      "digest": "sha256:2392e3360307aa7e058f1812bfdd367b002a9e74b8ebe8ac9d0d337063a0a909",
      "path": "artifacts/phase6/validation-report.json",
      "schemaVersion": "1.0.0"
    }
  },
  "canonicalSchemaVersion": "2.0.0",
  "channel": "candidate",
  "compatibleAppVersion": {
    "maximum": null,
    "minimum": "future-phase7",
    "productionAppReadsArtifact": false
  },
  "counts": {
    "aiActions": 1679,
    "areaAttacks": 75,
    "combatEnemies": 4673,
    "encounters": 1352,
    "enemies": 5032,
    "events": 88,
    "evidence": 801,
    "knownZeroFields": 3011,
    "manualCorrections": 0,
    "neutralEnemies": 443,
    "sourceSnapshots": 1,
    "stages": 801,
    "superAttacks": 4924,
    "unavailableFields": 20340,
    "unknownFields": 35152,
    "usageRules": 168
  },
  "datasetVersion": "canonical:jpnja:phase4-cache-c8c6a2468861",
  "generatedAt": "2026-02-23T08:11:11.385Z",
  "manifestId": "manifest:canonical:jpnja:phase4-cache-c8c6a2468861",
  "manifestSchemaVersion": "1.0.0",
  "permission": {
    "ledgerDigest": "sha256:d195d22977917a167e67694dfdbd1e54de452f8c1ff09ab91f52e14947692ac2",
    "offlineTransformAllowed": true,
    "productionPublishAllowed": false
  },
  "previousKnownGood": {
    "artifactDigest": "sha256:f1cb27a2e5cae9627be61934aaabec79e4af0b42d3e21ad0cc7945eb6d7a0b40",
    "datasetVersion": "legacy-production-current",
    "kind": "legacy-production",
    "manifestDigest": null
  },
  "releaseState": "candidate",
  "runtimeSchemaVersion": "1.0.0",
  "sourceSnapshots": [
    {
      "acquiredAt": "2026-02-23T08:11:11.385Z",
      "contentDigest": "sha256:c8c6a24688619fc2335e522e66214e01263b7cb762cc954f4c129fd91df7a022",
      "id": "snapshot:jpnja:phase4-cache-c8c6a2468861",
      "policyStatus": "offline-existing-copy",
      "sourceKey": "dokkaninfo-saved-cache"
    }
  ],
  "validation": {
    "gateVersion": "1.0.0",
    "hardFailCount": 0,
    "informationalCount": 0,
    "reportDigest": "sha256:2392e3360307aa7e058f1812bfdd367b002a9e74b8ebe8ac9d0d337063a0a909",
    "reviewRequiredCount": 1,
    "status": "review-required"
  }
}
